{
  "id": "1835",
  "title": "Chicago, summer 1835",
  "target_date": "1835-07-01",
  "terrain_epoch": "e1834_harbor_cut",
  "lighting": {
    "local_time": "12:30",
    "note": "Early afternoon, 1 July 1835. Sun azimuth and elevation are computed from this time and the datum lat/lon and drive both sky and the single directional light. Chosen so the south elevation is genuinely lit \u2014 at this latitude in July the sun is high, so vertical surfaces take light at a grazing angle and a mid-morning sun leaves a south wall too dark to read its documented white paint."
  },
  "spawn": {
    "local_e": 107.0,
    "local_n": -103.0,
    "yaw_deg": 180.0
  },
  "anchors": [
    {
      "id": "sauganash",
      "label": "The Sauganash, from Lake Street",
      "local_e": 107.0,
      "local_n": -103.0,
      "yaw_deg": 180.0
    },
    {
      "id": "sauganash_wing",
      "label": "The log wing, from the north-west",
      "local_e": 88.0,
      "local_n": -110.0,
      "yaw_deg": 150.0
    },
    {
      "id": "lake_market",
      "label": "Lake and Market, the corner itself",
      "local_e": 89.2,
      "local_n": -110.4,
      "yaw_deg": 135.0
    },
    {
      "id": "first_post_office",
      "label": "Hogan's store, where the mail came",
      "local_e": 113.0,
      "local_n": -108.0,
      "yaw_deg": 0.0
    },
    {
      "id": "forks",
      "label": "The forks, from Wolf Point",
      "local_e": -100.0,
      "local_n": -28.0,
      "yaw_deg": 75.0
    },
    {
      "id": "north_branch_bridge_deck",
      "label": "On the North Branch bridge, mid-span",
      "local_e": -81.59,
      "local_n": 262.02,
      "yaw_deg": 90.0
    },
    {
      "id": "green_tree",
      "label": "Green Tree Tavern, Lake and Canal",
      "local_e": -159.7,
      "local_n": -108.4,
      "yaw_deg": 90.0
    },
    {
      "id": "south_water",
      "label": "South Water Street, from the Wells Street corner",
      "local_e": 329.8,
      "local_n": 7.0,
      "yaw_deg": 90.0
    },
    {
      "id": "newberry_dole_wharf",
      "label": "Newberry & Dole's wharf, from the warehouse door",
      "local_e": 204.5,
      "local_n": 9.8,
      "yaw_deg": 339.4,
      "pitch_deg": -6.0
    },
    {
      "id": "from_above",
      "label": "From above \u2014 the whole town",
      "local_e": 60.0,
      "local_n": -330.0,
      "yaw_deg": 0.0,
      "altitude_m": 175.0,
      "pitch_deg": -30.0
    },
    {
      "id": "kinzie_block",
      "label": "The Kinzie Block, from Michigan Street",
      "local_e": 994.86,
      "local_n": 390.5,
      "yaw_deg": 0
    }
  ],
  "layers": [
    "terrain",
    "water",
    "structures",
    "flora",
    "fauna"
  ],
  "released": false,
  "note": "The first scene. Population roughly 3,265 in the late-1835 count; the town is twenty months old and has grown roughly tenfold in two years. Wabansia and Kinzie's Addition are platted (the Wooley correction was approved 17 June 1835, two weeks before this date) but almost entirely unbuilt. Anchor coordinates are provisional until the datum is verified \u2014 they are placeholders in the same local frame, not survey positions. Spawn and the near anchors are now derived from the Sauganash's real placement at Lake and Market \u2014 about 100 m east and 130 m south of the forks confluence \u2014 rather than from the datum origin, which is in the middle of the river. Both anchors that once pointed at a surveyed corner because their records had not landed have now resolved onto it: Green Tree stands at Lake and Canal looking east at the tavern, and South Water stands in the street at Wells. The South Water anchor was moved there on 2026-08-15 from (260, -95), which was 101 m south of the centreline of the street it is named for and framed a field. Its easting is the Wells corner the South Water records are themselves offset from (OpenStreetMap E 447402.5, N 4637411.6, the West Upper Wacker Drive / North Wells junction, quoted in those records' position notes); its northing is the committed South Water centreline at that easting (data/streets/1835.json), which sits about 9 m south of the modern junction centre because the 1835 line is shifted into the dry half of the platted riverfront corridor. A camera is not a placement, and this one claims nothing about a building. The forks anchor moved from (-20, -30) to (-100, -28) once the river channel was traced: the placeholder stood in the middle of the South Branch. It is now on the west bank at Wolf Point, which is what the name meant, looking east across the confluence and down the main stem. The wharf anchor (2026-08-18, T-0041) stands on the bank 3.6 m out of Newberry & Dole's river wall, looking down the waterward normal of the dock the wharf layer draws there \u2014 the ground at that point is 0.38 m above the water plane, so it is a stand on the bank and not on the deck, which is not a walk surface."
}
